request,response,politeness_markers,persuasion_techniques
Your website is quite confusing to navigate. Can you make it more user-friendly?,I appreciate your feedback regarding the website navigation. Improving the user experience is a top priority for us. Could you share some specific areas that were unclear or difficult to use? Your insights will help us enhance the website.,"Shows appreciation, agrees with importance","Acknowledges concern, requests specific feedback, highlights importance of user input"
I'm interested in your premium service but it seems too expensive. Can you offer a discount?,"Thank you for your interest in our premium service. While the cost may seem high initially, the service provides exceptional value through exclusive features and priority support. However, I'd be happy to explore potential discounts or package options that could better suit your needs and budget.","Shows appreciation, highlights value, demonstrates willingness to help","Acknowledges concern over cost, emphasizes benefits, offers personalized solutions"
I cancelled my subscription but was still charged. Can I get a refund?,I understand your frustration with being charged after cancelling. Let me look into your account details and ensure a full refund is processed promptly. Please accept my sincere apologies for this inconvenience.,"Shows understanding, offers immediate action, provides apology","Acknowledges mistake, offers prompt solution, expresses empathy"
Your customer service is terrible! I've been on hold for over an hour.,"Thank you for your patience while waiting. I can certainly understand your frustration with the long hold time. Please allow me to personally assist you right away, and I will ensure your issue is resolved as quickly as possible.","Expresses appreciation, shows understanding, offers immediate assistance","Acknowledges concern, provides personal attention, demonstrates urgency"
I'm not happy with the quality of your product. What can you do about this?,"I'm sorry to hear that you're not satisfied with the product quality. Your experience is important to us, and we take feedback like this seriously. Could you please provide more details about the specific issues you encountered? I'll ensure our team thoroughly investigates and addresses your concerns.","Offers apology, expresses importance of feedback, shows willingness to investigate","Acknowledges dissatisfaction, requests specific details, demonstrates commitment to resolution"
Why did you change your return policy without notifying customers?,"You raise a fair point. Clearly communicating policy changes is crucial, and we should have notified our customers proactively. Please allow me to review the details of the new return policy with you personally to ensure a smooth experience.","Agrees with valid concern, takes responsibility","Acknowledges mistake, offers personal attention, demonstrates commitment to resolution"
"I've been a loyal customer for years, but your prices keep increasing.","I truly value your long-standing loyalty and appreciate you bringing this concern to my attention. While prices are subject to periodic adjustments, let me explore potential discounts or package options that could provide better value for your continued support.","Expresses appreciation, acknowledges concern, demonstrates willingness to help","Highlights customer value, offers personalized solutions, emphasizes long-term relationship"
Your product description was misleading. I expected better quality.,"You're absolutely right, and I apologize for the misleading product description. Clear and accurate information is essential, and we'll promptly review the details to ensure they accurately represent the product quality. In the meantime, please let me know how I can make this right for you.","Agrees with criticism, offers apology, expresses importance of accurate information","Acknowledges mistake, demonstrates commitment to improvement, offers personal resolution"
I have a complaint about one of your employees who was rude and unhelpful.,"Thank you for bringing this issue to our attention. Providing excellent customer service is a top priority, and the experience you described is unacceptable. Please share the details, and I will personally ensure this matter is investigated and addressed appropriately.","Shows appreciation, expresses importance of good service, demonstrates personal attention","Acknowledges concern, requests specific details, demonstrates commitment to resolution"
I ordered a product last week but still haven't received any shipping updates. Can you check the status?,"Thank you for your patience, and I apologize for the delay. Let me look into your order right away. Could you please provide your order number so I can expedite shipping and ensure it arrives promptly?","apologizes, thanks for patience, requests order number","acknowledges delay, offers to expedite, ensures prompt resolution"
Your return policy seems very strict. I'd like to return an item but am worried about fees or restocking charges.,"I understand your concern about our return policy. At our company, we prioritize customer satisfaction above all else. If you're not completely happy with your purchase for any reason, you can return it within 30 days for a full refund, no questions asked and no restocking fees.","understands concern, prioritizes satisfaction","reassures no fees, offers unconditional return"
I saw one of your competitors offering a similar product for much less. Why should I choose your company?,"Thank you for your interest. While our prices may seem higher upfront, our products are built to last using premium materials. We also offer exceptional customer service and a comprehensive warranty. In the long run, our quality products provide better value. Perhaps I could explain how our offering aligns with your specific needs?","thanks for interest, addresses pricing concern","highlights quality, service and warranty, offers personalized value explanation "
Your website is so confusing to navigate. I'm having trouble finding what I need.,"You're absolutely right, our current website could use some improvements to make it more user-friendly. I sincerely apologize for the frustration this has caused you. Please let me know exactly what you're looking for - I'd be happy to personally guide you in the right direction or suggest better ways to find it.","agrees with criticism, apologizes sincerely","acknowledges issue, offers personal assistance, open to suggestions"
I wish your company had a live chat option for quicker assistance.,"That's an excellent suggestion to improve our customer experience. Real-time support would certainly be more convenient. While we don't have live chat yet, I've made a note of your feedback to share with our management team. In the meantime, please feel free to email me anytime with urgent queries, and I'll respond as quickly as possible.","appreciates suggestion, notes feedback","proposes current alternative, commits to rapid response"
