request,response,politeness_markers,persuasion_techniques
"Can you refund my order? It arrived damaged.","""I completely understand your frustration with receiving a damaged order. I'd be happy to process a full refund right away. Would you mind providing your order number so I can expedite this for you?""","Understanding empathy, offers immediate help, uses 'happy to'","Acknowledges concern, offers immediate solution, demonstrates eagerness to help"
"Why is your software so expensive?","""Thank you for your interest in our software. While I appreciate your concern about the price, I'd love to explain the unique value it provides. Our solution includes 24/7 support, regular updates, and features that typically save businesses 20+ hours per month. Would you like me to break down the specific benefits for your use case?""","Thanks expression, shows appreciation, uses 'appreciate'","Acknowledges concern, provides concrete benefits, offers personalization"
"I need this project done by tomorrow - it's urgent.","""I truly appreciate you bringing this urgent deadline to my attention. While tomorrow is quite challenging, I can prioritize your project and deliver the most critical components first. Could we discuss which elements are most essential to help ensure you get what you need most urgently?""","Shows appreciation, acknowledges situation, offers collaboration","Demonstrates understanding, provides alternative solution, shows proactive thinking"
"Your website is confusing and hard to use.","""Thank you for this valuable feedback about our website. I apologize for any frustration you've experienced. Would you be willing to share which specific areas you found challenging? I'd be grateful for your insights to help us improve, and in the meantime, I'd be happy to guide you directly to what you're looking for.""","Expresses gratitude, apologizes sincerely, offers assistance","Turns criticism into opportunity, shows willingness to help, demonstrates active listening"
"Cancel my subscription immediately.","""I understand you'd like to cancel your subscription, and I'll certainly help you with that. Before I process the cancellation, may I ask about what led to your decision? We might have solutions that address your concerns, though I'll respect whatever choice you make.""","Shows understanding, offers help, demonstrates respect","Acknowledges request, seeks information, offers alternatives while respecting choice"
"Why haven't you responded to my email from last week?","""I sincerely apologize for the delayed response to your email. This is not our typical level of service, and I understand how frustrating waiting can be. I've located your email and will address your concerns right now. How can I best help you today?""","Sincere apology, shows understanding, offers immediate action","Accepts responsibility, shows immediacy in fixing issue, demonstrates accountability"
"This product doesn't work as advertised.","""I'm truly sorry to hear the product isn't meeting your expectations. Could you please share more details about what specific features aren't working as expected? I'm committed to either helping you resolve this or finding an alternative solution that better suits your needs.""","Sincere apology, shows commitment, offers help","Acknowledges disappointment, seeks specific information, offers multiple solutions"
"Your competitor offers this for half the price.","""Thank you for bringing this to our attention. While our pricing may be different, I'd love to explain the unique features and benefits that make our solution stand out. For instance, we offer [specific features] that provide significant additional value. Would you like to explore how these could benefit your specific situation?""","Shows gratitude, offers explanation, personalizes response","Acknowledges comparison, focuses on value proposition, offers personalized insight"
"I've been waiting on hold for 30 minutes.","""I sincerely apologize for the long wait time - this is absolutely not the experience we want for our valued customers. I'm here now and will give your concern my full attention. Please let me know what you need assistance with, and I'll help you right away.""","Sincere apology, shows value, offers immediate attention","Acknowledges inconvenience, shows immediate availability, demonstrates commitment"
"Fix this issue or I'm switching to your competitor.","""I completely understand your frustration, and I want to make this right for you. I'm personally committed to resolving this issue quickly and effectively. Could you share more details about the specific problems you're experiencing? I'll work to find a solution that exceeds your expectations.""","Shows understanding, personal commitment, offers solution","Acknowledges concern, shows personal investment, demonstrates problem-solving focus"
"Your instructions are completely unclear.","""Thank you for this feedback about our instructions. I apologize for any confusion they've caused. Would you be comfortable pointing out which sections were unclear? I'd be happy to walk you through the process step-by-step right now, and we'll use your feedback to improve our documentation.""","Shows gratitude, apologizes, offers immediate help","Turns negative feedback positive, offers immediate assistance, shows willingness to improve"
"I don't want to renew - it's too expensive.","""I appreciate you letting us know about your renewal concerns. I understand that cost is an important factor in your decision. Would you be interested in learning about our flexible payment plans or our cost-saving annual packages? I'm confident we can find an option that better fits your budget.""","Shows appreciation, understanding, offers alternatives","Acknowledges concern, provides options, focuses on finding solution"
"This is the third time I'm asking for help.","""I sincerely apologize that you've had to reach out multiple times - this must be incredibly frustrating. I'm going to personally ensure your issue is resolved today. Could you please provide a brief overview of the problem, and I'll make this my top priority?""","Sincere apology, shows empathy, offers personal attention","Acknowledges history, shows commitment to resolution, demonstrates urgency"
"Your service is terrible.","""I'm truly sorry you've had a negative experience with our service. This is not the standard we aim for, and I want to make things right. Could you share more about what went wrong? I'll personally ensure these issues are addressed and find a way to rebuild your trust in our service.""","Sincere apology, shows commitment, personal investment","Acknowledges feedback, shows commitment to improvement, focuses on rebuilding trust"
"I want to speak to a manager right now.","""I understand you'd like to speak with a manager, and I respect that request. I want to assure you that I'm fully empowered to help resolve your concern immediately. Could you share what's troubling you? If we still need a manager's input after our discussion, I'll arrange that right away.""","Shows understanding, respect, offers immediate help","Acknowledges request, demonstrates authority to help, offers immediate assistance"
"Why should I choose your product over others?","""Thank you for considering our product. I'd be delighted to highlight what makes us unique in the market. Our solution specifically excels in [key features], and our customers particularly value our dedicated support team. Would you like to hear about how these benefits align with your specific needs?""","Shows gratitude, enthusiasm, offers personalization","Focuses on unique value, provides specific benefits, offers personalized insight"
"This is way too complicated to set up.","""I understand setting up new software can feel overwhelming. I'd be happy to guide you through the process step by step. Many of our customers had similar concerns initially but found it quite manageable with a bit of guidance. Would you like to start with the most essential features first?""","Shows understanding, offers help, provides reassurance","Acknowledges difficulty, offers direct support, provides social proof"
"You keep sending me spam emails.","""I apologize for any unwanted communications you've received. I can help you adjust your email preferences right now to ensure you only receive the information that's valuable to you. Would you like me to walk you through these settings, or would you prefer to unsubscribe completely?""","Apologizes, offers immediate help, provides options","Acknowledges concern, offers immediate solution, provides control"
"I need a discount or I'm not buying.","""I appreciate you being direct about your pricing concerns. While we maintain consistent pricing to ensure fairness for all customers, I'd be happy to explore our various packages and payment plans that might better fit your budget. Would you like to hear about our current promotions?""","Shows appreciation, explains policy, offers alternatives","Acknowledges request, maintains policy while offering options, focuses on finding solution"
"Your app keeps crashing.","""I'm very sorry to hear you're experiencing crashes with our app. This must be frustrating for you. Could you share which device and operating system you're using? I'll help you resolve this immediately and ensure our technical team addresses any underlying issues.""","Apologizes, shows empathy, offers immediate help","Acknowledges problem, seeks specific information, offers immediate assistance"
"I've been waiting for a response for days.","""I sincerely apologize for the delayed response - this is not our standard of service, and you deserve better. I'm here now and will make your concern my top priority. Could you please refresh my memory on your inquiry? I'll ensure you get a complete resolution today.""","Sincere apology, shows commitment, offers immediate attention","Acknowledges delay, shows urgency in response, demonstrates commitment to resolution"
"Your pricing page is misleading.","""Thank you for bringing this concern to our attention. I apologize for any confusion our pricing page may have caused. Could you point out which aspects you found misleading? I'll ensure this feedback reaches our team to improve clarity, and I'd be happy to explain our pricing structure in detail.""","Shows gratitude, apologizes, offers clarification","Acknowledges feedback, shows commitment to improvement, offers immediate clarification"
"I don't have time for a long explanation.","""I'll keep this brief and focused. The key point is [concise solution/answer]. Would you like me to quickly implement this for you now, or would you prefer a short written summary of the next steps?""","Respects time constraint, offers options, direct approach","Demonstrates efficiency, provides immediate solution, respects user's time"
"Your product is missing basic features.","""Thank you for this feedback about our features. I'd be interested to know which specific features you're looking for. While we might have alternative ways to accomplish your goals, your input would be valuable for our product development team. Could you share more details?""","Shows gratitude, interest, offers to help","Acknowledges feedback, seeks specific information, shows value of input"
"This is nothing like what was promised.","""I apologize if our product hasn't met your expectations. I'd like to understand the specific differences between what you expected and what you're experiencing. This will help me either show you how to achieve your goals or find an appropriate solution. Could you share more details?""","Apologizes, shows interest, offers to help","Acknowledges disappointment, seeks specific information, focuses on solutions"
"I want my money back - this isn't working.","""I understand your frustration and apologize for any inconvenience. I'd be happy to process a refund for you. First, may I quickly check if there are any specific issues I could help resolve? If not, I'll begin the refund process right away.""","Shows understanding, apologizes, offers options","Acknowledges request, offers immediate solution while exploring alternatives"
"Your company never follows through.","""I sincerely apologize for any instances where we haven't met our commitments. I want to change your experience with us. Could you share specific examples so I can address them personally? I'll ensure proper follow-through and keep you updated every step of the way.""","Sincere apology, shows commitment, offers personal attention","Acknowledges concern, shows commitment to improvement, offers personal oversight"
"This is completely unacceptable.","""I absolutely agree that this situation is not acceptable, and I sincerely apologize. I want to make this right for you immediately. Could you help me understand exactly what happened? I'll take personal responsibility for resolving this situation to your satisfaction.""","Agrees with concern, apologizes, shows commitment","Acknowledges severity, takes responsibility, demonstrates commitment to resolution"
"I've wasted so much time on this.","""I sincerely apologize for the time you've lost dealing with this issue. I understand how valuable your time is, and I'm committed to resolving this quickly and efficiently. May I know what specific problems you've encountered? I'll expedite a solution for you.""","Sincere apology, acknowledges value of time, offers quick resolution","Acknowledges lost time, shows urgency, focuses on efficient resolution"
"Your support team is useless.","""I'm truly sorry you've had a disappointing experience with our support team. This is not the level of service we strive for. I'm going to personally handle your case and ensure you receive the support you deserve. What specific issue can I help resolve for you today?""","Sincere apology, shows commitment, offers personal attention","Acknowledges disappointment, takes personal responsibility, focuses on immediate help"
"My order never arrived, what happened?",I apologize for the inconvenience caused by the missing order. Let me look into the details and get back to you promptly with an update. Could you please provide your order number?,"shows empathy, offers follow-up","acknowledges issue, requests information"
Your website is very confusing to navigate.,Thank you for the feedback about our website navigation. We're always looking to improve the user experience. Could you share some specific areas you found challenging? Your input would be valuable for our development team.,"expresses gratitude, requests input","appreciates feedback, offers follow-up"
I want to cancel my subscription immediately.,"I understand your decision to cancel, and I'm sorry we didn't meet your expectations. Before processing the cancellation, could I ask what led to this decision? Your feedback can help us improve our service.","shows understanding, expresses regret","acknowledges request, invites feedback"
Your product is incredibly overpriced.,"Thank you for your honest opinion. Our pricing reflects the quality and value we aim to provide. However, I'd be happy to discuss your specific needs and see if there are cost-saving options that could work for you.","acknowledges opinion, offers alternatives","appreciates feedback, provides personalization"
I need to speak to a manager about a serious issue.,"I appreciate you bringing this serious matter to our attention. While I may not have all the details, I'll be sure to notify a manager right away to address your concerns properly. Your patience is appreciated.","expresses appreciation, assures escalation","acknowledges urgency, commits to action"
This is the worst customer service ever!,"I sincerely apologize that we've failed to provide satisfactory service so far. That is unacceptable, and I want to make this right. Could you please explain the issues you've faced so I can understand and take appropriate action?","shows empathy, offers resolution","acknowledges failure, requests details"
Your shipping costs are outrageous.,"Thank you for sharing your perspective on our shipping costs. I understand they may seem high. However, we strive to offset those costs through exceptional service and quality products. Perhaps we could explore more cost-effective shipping options for your needs?","expresses gratitude, provides rationale","appreciates feedback, suggests alternatives"
Why was my refund request denied?,"I apologize for any frustration caused by the denied refund request. Let me review the details of your case and provide a clear explanation. If there has been a misunderstanding, I'll be happy to reassess and ensure a fair resolution.","shows empathy, offers review","acknowledges concern, commits to resolution"
Do you offer any discounts for loyal customers?,"Absolutely, we value the loyalty of our customers greatly. For frequent shoppers like yourself, we offer exclusive discounts and promotions throughout the year. I'd be happy to explain our loyalty program benefits in more detail.","expresses appreciation, offers value","acknowledges loyalty, provides incentive"
I've been on hold for over an hour!,"You're absolutely right, that wait time is unacceptable. I sincerely apologize for the excessive delay. Let me escalate your case right away to ensure you receive prompt assistance. Your patience is appreciated.","shows empathy, offers escalation","acknowledges issue, commits to action"
Your product broke after only a month of use.,Thank you for bringing this product issue to our attention. That's certainly not the quality experience we aim for. Let's start by gathering some details about the product failure so I can properly document and address this for you.,"expresses gratitude, requests details","appreciates feedback, demonstrates proactive approach"
Why is my order taking so long?,"Thank you for your patience regarding your order. We are currently experiencing higher than normal volume, but I completely understand your concern. May I have your order number so I can provide you with an updated delivery estimate?","Shows understanding, uses appreciation, asks for information","Acknowledges customer's situation, offers specific solution"
Your product has a defect and needs to be replaced.,"I'm very sorry to hear about the defect with your product. Customer satisfaction is our top priority, and we'll be happy to send you a replacement right away at no additional cost. Could you please provide me with your order details?","Shows empathy, prioritizes customer satisfaction, offers replacement, uses polite language","Acknowledges issue, provides satisfactory solution, requests necessary information"
I need to cancel my subscription.,"Thank you for sharing your request. I understand the need to cancel can arise for various reasons. To better assist you, could you kindly let me know your account details? I'd be happy to guide you through the process.","Expresses appreciation, shows understanding, offers help, uses polite language","Acknowledges request, willing to assist, requests necessary information"
The product description was misleading.,I appreciate you bringing this to our attention. Providing accurate information is extremely important to us. Could you please share which details were misleading so we can review and update our product descriptions?,"Shows appreciation, stresses importance, asks for specifics","Acknowledges concern, shows willingness to improve, requests clarification"
When will my refund be processed?,Thank you for your patience regarding your refund request. I completely understand your eagerness for a prompt resolution. Let me look into the details of your case and provide you with an update on the expected timeframe.,"Expresses appreciation, shows understanding, demonstrates eagerness to help","Acknowledges situation, provides reassurance, commits to follow-up"
Your customer service is unacceptable.,"Thank you for taking the time to share your feedback. I sincerely apologize that our service did not meet your expectations. Your concerns are important to us, and we strive to continuously improve. Could you please provide more details so we can address this issue?","Shows appreciation, offers sincere apology, stresses importance of feedback, requests details","Acknowledges complaint, expresses desire for improvement, requests clarification"
I received the wrong item.,"I understand your frustration regarding the incorrect item received. Please accept my sincere apologies for this mistake on our part. I would be happy to promptly arrange for a replacement of the correct item or a full refund, whichever you prefer.","Shows understanding, offers sincere apology, expresses willingness to rectify","Acknowledges mistake, provides satisfactory solutions"
The website is not user-friendly.,Thank you for bringing this issue to our attention. We value feedback like yours as it helps us enhance the user experience. Could you please share more details about the specific areas that were not user-friendly? We'd appreciate the opportunity to improve.,"Expresses appreciation, highlights value of feedback, requests specifics, shows willingness to improve","Acknowledges issue, demonstrates desire for improvement, requests clarification"
How can I track my order?,Thank you for your interest in tracking your order. I'd be happy to assist you with that. Could you please provide me with your order number or shipping reference? I'll be glad to look it up and share the current status with you.,"Shows appreciation, offers assistance, uses polite language, demonstrates willingness to help","Acknowledges request, requests necessary information, commits to providing solution"
Your prices are too high compared to competitors.,"I appreciate your concern about our pricing. While we aim to offer competitive rates, our products are crafted with premium quality materials and backed by exceptional customer service. I'd be happy to further discuss how our offerings provide value that justifies the investment.","Shows appreciation, acknowledges concern, highlights unique value proposition, offers further discussion","Acknowledges pricing concern, provides justification, demonstrates willingness to continue conversation"
The product I received is damaged.,"Thank you for bringing this issue to our attention. I sincerely apologize for the inconvenience caused by receiving a damaged product. We take great pride in our quality assurance, and this should not have occurred. Please let me know if you would prefer a replacement or a full refund.","Expresses appreciation, offers sincere apology, acknowledges mistake, provides options","Acknowledges issue, takes responsibility, provides satisfactory solutions"
I want to return an item but the process is confusing.,I understand that navigating the return process can be confusing at times. Please allow me to walk you through the steps to ensure a smooth experience. Could you provide me with your order details so I can better assist you?,"Shows understanding, offers assistance, uses polite language, requests necessary information","Acknowledges concern, commits to providing guidance, requests clarification"
Your shipping costs are ridiculously high.,Thank you for sharing your feedback on our shipping costs. We continually evaluate our rates to remain competitive while providing reliable and secure delivery services. I'd be happy to explore alternative shipping options that may better suit your needs and budget.,"Shows appreciation, highlights efforts to be competitive, offers alternative solutions","Acknowledges concern, provides justification, demonstrates willingness to explore options"
This product is not working as advertised.,"I'm very sorry to hear that the product is not functioning as expected based on our advertising. We take great pride in accurately representing our offerings, and we clearly fell short in this case. Please allow me to gather more details so we can fully investigate and make this right.","Offers sincere apology, acknowledges mistake, expresses commitment to resolve","Acknowledges issue, takes responsibility, commits to investigation and resolution"
I need to update my billing information.,"Thank you for reaching out about updating your billing information. I'd be happy to assist you with that process. For your security, could you please confirm your account details? I'll ensure the changes are made promptly and accurately.","Shows appreciation, offers assistance, prioritizes security, ensures prompt service","Acknowledges request, requests necessary information, commits to timely and accurate service"
Your website keeps crashing.,"Thank you for bringing this technical issue to our attention. We take website performance very seriously, and your feedback helps us identify and resolve problems promptly. Could you please provide more details about the specific errors or issues you've encountered? We appreciate the opportunity to improve.","Expresses appreciation, acknowledges issue seriously, highlights value of feedback, requests details","Acknowledges concern, demonstrates commitment to resolution, requests clarification"
Your product selection is too limited.,I appreciate you sharing your perspective on our product selection. Customer feedback is invaluable in helping us expand our offerings to better meet diverse needs. Could you elaborate on the specific types of products you
I ordered a product last week but haven't received any shipping updates. When can I expect my order?,"Thank you for your patience, and I apologize for the delay in shipping updates. Let me look into the status of your order right away. Could you please provide your order number so I can investigate further?","Expresses appreciation, offers apology, shows willingness to help","Acknowledges concern, requests specific information, demonstrates proactive approach"
